<?xml version="1.0" encoding="UTF-8"?>
<podnikající_fyzická_osoba_nezapsaná_v_or 
xmlns="http://dia.gov.cz/ns/spolecne-casti-elektronickych-dokumentu/osoby" 
xmlns:xsi="http://www.w3.org/2001/XMLSchema-instance" 
xmlns:místa="http://dia.gov.cz/ns/spolecne-casti-elektronickych-dokumentu/mista"
xsi:schemaLocation="http://dia.gov.cz/ns/spolecne-casti-elektronickych-dokumentu/osoby https://ofn.gov.cz/společné-části-elektronických-dokumentů/2024-10-04/schémata/osoby/podnikající-fyzická-osoba-nezapsaná-v-or.xsd">
	<jméno>Jan</jméno>
	<další_jména>Jaromír Hynek</další_jména>
	<příjmení>Novák</příjmení>
	<datum_narození>1957-08-13</datum_narození>
	<dodatky xml:lang="cs">Klempíř</dodatky>
	<datová_schránka>abcdef</datová_schránka>
	<trvalé_bydliště>
		<místa:zahraniční_adresa>
			<místa:text_adresy>Philharmoniker Str. 4, 1010 Wien, Austria</místa:text_adresy>
		</místa:zahraniční_adresa>
	</trvalé_bydliště>
</podnikající_fyzická_osoba_nezapsaná_v_or>
